{
  "spec": "tnf/executable-intelligence/0.2",
  "artifact_id": "eia-b2783de3b10f619b",
  "generated_at": "2026-05-19T07:35:37+00:00",
  "classification": {
    "class": "INTEL",
    "status": "PENDING"
  },
  "namespace": "intelligence",
  "ownership": {
    "owner_principal_id": "danielgoldberg",
    "visibility": "private",
    "release_state": "sealed",
    "agent_allowlist": [],
    "release_approved_by": "",
    "released_at": "",
    "release_note": ""
  },
  "source": {
    "source_id": "yt-ai5-65IAqRUxg3c",
    "source_type": "video",
    "source_uri": "https://www.youtube.com/watch?v=65IAqRUxg3c&list=PLSdNsZjFbYrUocyjWmVB75W8cZbI0ZmvS&index=8&pp=iAQBsAgC",
    "source_title": "AI Agents run my business and life",
    "source_author": "",
    "source_publisher": "",
    "source_published_at": "",
    "retrieved_at": "2026-05-19T07:35:37+00:00",
    "resource_pointer": "https://www.youtube.com/watch?v=65IAqRUxg3c&list=PLSdNsZjFbYrUocyjWmVB75W8cZbI0ZmvS&index=8&pp=iAQBsAgC",
    "source_digest_sha256": "62ee5e0f4a8f611765fd5016cbc32481e72f57bd881c4a57287effce6bb4e021"
  },
  "taxonomy": {
    "procedural": [
      "Video Title: AI Agents run my business and life",
      "run his personal and business life.",
      "is a guy who has a great setup.",
      "next generation business is and where he",
      "he's using AI agents to run his life and",
      "&gt;&gt; Andrew Wilkinson, I think third time on",
      "Uh they're going to learn how to build a",
      "they're going to learn a few prompt",
      "trying to build an open claw agent uh",
      "test before I started doing this in our",
      "a business um a SaaS business, and then",
      "heroin, the first time is the best time.",
      "Um, but I'd set up an",
      "OpenClaw agent on my computer, and I",
      "basically was able to run my entire",
      "time making it better, and then 20% of",
      "Um, but we have been able to build some",
      "uh I wanted to build a custom GPT uh or",
      "multiple-choice test, set up scoring,",
      "and then put them in a JSON file?\" And"
    ],
    "strategic": [
      "blazing architect.",
      "have a model that's just like a CEO",
      "model or or and just like delegate to",
      "my strategy is basically been",
      "makes it highly searchable for an LLM.",
      "all the cost, but I could probably build",
      "actually just, um, scaling the API cost.",
      "market data, and it just tells you like,"
    ],
    "governance": [
      "scary security breach, it'll just",
      "that are at the most risk.",
      "But even that I think is at risk with"
    ]
  },
  "utility_metrics": {
    "freshness_decay": "High",
    "implementation_density": 0.024,
    "verification_difficulty": "Hard"
  },
  "gate_results": {
    "definition_class_validation": {
      "passed": true,
      "reason": "Artifact follows executable intelligence schema and taxonomy."
    },
    "library_namespace_assignment": {
      "passed": true,
      "namespace": "intelligence"
    },
    "flag_integrity": {
      "passed": true,
      "class": "INTEL",
      "status": "PENDING"
    },
    "linkage_attribution": {
      "passed": true,
      "resource_pointer": "https://www.youtube.com/watch?v=65IAqRUxg3c&list=PLSdNsZjFbYrUocyjWmVB75W8cZbI0ZmvS&index=8&pp=iAQBsAgC"
    },
    "ownership_scope_gate": {
      "passed": true,
      "owner_principal_id": "danielgoldberg",
      "visibility": "private",
      "release_state": "sealed"
    }
  },
  "synthesis": "Artifact captures 20 procedural, 8 strategic, and 3 governance units. Use procedural units for immediate execution, then vet strategic and governance units through TNF gates before protocol adoption.",
  "raw_stats": {
    "char_count": 30471,
    "unit_count": 834
  }
}
