{
  "spec": "tnf/executable-intelligence/0.2",
  "artifact_id": "eia-adc99f01b8e8fe58",
  "generated_at": "2026-05-19T05:25:11+00:00",
  "classification": {
    "class": "INTEL",
    "status": "PENDING"
  },
  "namespace": "intelligence",
  "ownership": {
    "owner_principal_id": "danielgoldberg",
    "visibility": "private",
    "release_state": "sealed",
    "agent_allowlist": [],
    "release_approved_by": "",
    "released_at": "",
    "release_note": ""
  },
  "source": {
    "source_id": "yt-ai5-9rXH2ssCe9E",
    "source_type": "video",
    "source_uri": "https://www.youtube.com/watch?v=9rXH2ssCe9E&list=PLSdNsZjFbYrUocyjWmVB75W8cZbI0ZmvS&index=34&pp=iAQBsAgC",
    "source_title": "Hermes Agent has a NEW SuperPower (NotebookLM)",
    "source_author": "",
    "source_publisher": "",
    "source_published_at": "",
    "retrieved_at": "2026-05-19T05:25:11+00:00",
    "resource_pointer": "https://www.youtube.com/watch?v=9rXH2ssCe9E&list=PLSdNsZjFbYrUocyjWmVB75W8cZbI0ZmvS&index=34&pp=iAQBsAgC",
    "source_digest_sha256": "1f8f6a4289c4678c9a4bdb89e87a123f7ceec8f5309e11a8c08cc5b7e5216add"
  },
  "taxonomy": {
    "procedural": [],
    "strategic": [
      "Distill concrete implementation logic and architecture signals."
    ],
    "governance": []
  },
  "utility_metrics": {
    "freshness_decay": "Medium",
    "implementation_density": 0.0,
    "verification_difficulty": "Hard"
  },
  "gate_results": {
    "definition_class_validation": {
      "passed": true,
      "reason": "Artifact follows executable intelligence schema and taxonomy."
    },
    "library_namespace_assignment": {
      "passed": true,
      "namespace": "intelligence"
    },
    "flag_integrity": {
      "passed": true,
      "class": "INTEL",
      "status": "PENDING"
    },
    "linkage_attribution": {
      "passed": true,
      "resource_pointer": "https://www.youtube.com/watch?v=9rXH2ssCe9E&list=PLSdNsZjFbYrUocyjWmVB75W8cZbI0ZmvS&index=34&pp=iAQBsAgC"
    },
    "ownership_scope_gate": {
      "passed": true,
      "owner_principal_id": "danielgoldberg",
      "visibility": "private",
      "release_state": "sealed"
    }
  },
  "synthesis": "Artifact captures 0 procedural, 1 strategic, and 0 governance units. Use procedural units for immediate execution, then vet strategic and governance units through TNF gates before protocol adoption.",
  "raw_stats": {
    "char_count": 605,
    "unit_count": 10
  }
}
