{
  "spec": "tnf/executable-intelligence/0.2",
  "artifact_id": "eia-625f3f761b57600b",
  "generated_at": "2026-05-19T07:42:38+00:00",
  "classification": {
    "class": "INTEL",
    "status": "PENDING"
  },
  "namespace": "intelligence",
  "ownership": {
    "owner_principal_id": "danielgoldberg",
    "visibility": "private",
    "release_state": "sealed",
    "agent_allowlist": [],
    "release_approved_by": "",
    "released_at": "",
    "release_note": ""
  },
  "source": {
    "source_id": "yt-ai5-vi-2nasppAg",
    "source_type": "video",
    "source_uri": "https://www.youtube.com/watch?v=vi-2nasppAg&list=PLSdNsZjFbYrUocyjWmVB75W8cZbI0ZmvS&index=21&t=38s&pp=iAQBsAgC",
    "source_title": "Make your own event-sourced agent harness using stream processors \u2014 Jonas Templestein, Iterate",
    "source_author": "",
    "source_publisher": "",
    "source_published_at": "",
    "retrieved_at": "2026-05-19T07:42:38+00:00",
    "resource_pointer": "https://www.youtube.com/watch?v=vi-2nasppAg&list=PLSdNsZjFbYrUocyjWmVB75W8cZbI0ZmvS&index=21&t=38s&pp=iAQBsAgC",
    "source_digest_sha256": "b744d5902e6435ace8913a5fe480bac46cd68536e95db3d555fb854613a759aa"
  },
  "taxonomy": {
    "procedural": [
      "Video Title: Make your own event-sourced agent harness using stream processors \u2014 Jonas Templestein, Iterate",
      "I think pure chaos first of all because",
      "to do this and then there was like um",
      "and the kids were sick and then this",
      "then we came here and we're told you're",
      "SDK literally one minute ago, and Misha",
      "build agent harnesses.",
      "that you later can't tell and then you",
      "see that in a second is they already",
      "Um, and then the",
      "second thing is I want I want this to be",
      "an agent extensible not just by humans",
      "for for for agents basically for agent",
      "has to run in a single thread in in in",
      "then I think it should be on the edge",
      "And then I would just",
      "an agent exists, it should have a URL.",
      "up making all these things and then you",
      "agent again or or something like that.",
      "And then it should be"
    ],
    "strategic": [
      "based on this architecture.",
      "that are on the market right now.",
      "What's the architecture?",
      "arguments in favor of this architecture",
      "might in the future need to trigger LLM",
      "and um make a ton of LLM requests for"
    ],
    "governance": []
  },
  "utility_metrics": {
    "freshness_decay": "Medium",
    "implementation_density": 0.025,
    "verification_difficulty": "Hard"
  },
  "gate_results": {
    "definition_class_validation": {
      "passed": true,
      "reason": "Artifact follows executable intelligence schema and taxonomy."
    },
    "library_namespace_assignment": {
      "passed": true,
      "namespace": "intelligence"
    },
    "flag_integrity": {
      "passed": true,
      "class": "INTEL",
      "status": "PENDING"
    },
    "linkage_attribution": {
      "passed": true,
      "resource_pointer": "https://www.youtube.com/watch?v=vi-2nasppAg&list=PLSdNsZjFbYrUocyjWmVB75W8cZbI0ZmvS&index=21&t=38s&pp=iAQBsAgC"
    },
    "ownership_scope_gate": {
      "passed": true,
      "owner_principal_id": "danielgoldberg",
      "visibility": "private",
      "release_state": "sealed"
    }
  },
  "synthesis": "Artifact captures 20 procedural, 6 strategic, and 0 governance units. Use procedural units for immediate execution, then vet strategic and governance units through TNF gates before protocol adoption.",
  "raw_stats": {
    "char_count": 30541,
    "unit_count": 805
  }
}
