{
  "spec": "tnf/executable-intelligence/0.2",
  "artifact_id": "eia-a2ced6076927e37a",
  "generated_at": "2026-05-17T14:17:10+00:00",
  "classification": {
    "class": "INTEL",
    "status": "PENDING"
  },
  "namespace": "intelligence",
  "ownership": {
    "owner_principal_id": "danielgoldberg",
    "visibility": "private",
    "release_state": "sealed",
    "agent_allowlist": [],
    "release_approved_by": "",
    "released_at": "",
    "release_note": ""
  },
  "source": {
    "source_id": "apple-notes-new-may-2026-6237",
    "source_type": "note",
    "source_uri": "apple-notes://on-my-mac/NEW-%20May-2026/6237",
    "source_title": "Protocolized execution is now in place, not a one-off.",
    "source_author": "",
    "source_publisher": "",
    "source_published_at": "",
    "retrieved_at": "2026-05-17T14:17:10+00:00",
    "resource_pointer": "apple-notes://on-my-mac/NEW-%20May-2026/6237",
    "source_digest_sha256": "196badc03e8a1ea4ba0defcc076d9200a955387317c1b2047b1e8a7c5f8b2e2b"
  },
  "taxonomy": {
    "procedural": [
      "- .tnf/session-discovery/terminal-role-map.json",
      "- .tnf/session-discovery/terminal-identity-registry.json",
      "- .tnf/reports/protocols/agent-state-governance/plan-20260513T160753Z.json",
      "20260513T160857Z.json",
      "20260513T160854Z.json",
      "ComprehensiveRouter.tsx:52",
      "ComprehensiveRouter.tsx:875",
      "- Desktop/A1-Inter-LLM-Com/The-New-Fuse/apps/frontend/src/config/",
      "- Desktop/A1-Inter-LLM-Com/The-New-Fuse/apps/api/src/controllers/",
      "- Runtime webhook/http/condition node handling:",
      "- Desktop/A1-Inter-LLM-Com/The-New-Fuse/apps/api/src/services/workflow/",
      "Workflows.tsx:87",
      "Workflows.tsx:310",
      "issues (frontend-wide and API director module import issues), not from this"
    ],
    "strategic": [
      "Recovery and integration status in current worktree:",
      "- Desktop/A1-Inter-LLM-Com/The-New-Fuse/apps/frontend/src/",
      "- Desktop/A1-Inter-LLM-Com/The-New-Fuse/apps/frontend/src/config/",
      "Webhook orchestration extensions:",
      "- Desktop/A1-Inter-LLM-Com/The-New-Fuse/apps/api/src/controllers/",
      "- Desktop/A1-Inter-LLM-Com/The-New-Fuse/apps/api/src/services/workflow/",
      "- Desktop/A1-Inter-LLM-Com/The-New-Fuse/apps/frontend/src/services/",
      "- Desktop/A1-Inter-LLM-Com/The-New-Fuse/apps/frontend/src/hooks/",
      "- Desktop/A1-Inter-LLM-Com/The-New-Fuse/apps/frontend/src/pages/",
      "- Desktop/A1-Inter-LLM-Com/The-New-Fuse/docs/protocols/reports/"
    ],
    "governance": [
      "- Ran TNF state governor audit -> plan -> apply -> verify and safely removed",
      "- .tnf/reports/protocols/agent-state-governance/plan-20260513T160753Z.json",
      "- .tnf/reports/protocols/agent-state-governance/apply-",
      "- .tnf/reports/protocols/agent-state-governance/audit-",
      "Durable protocol report written:"
    ]
  },
  "utility_metrics": {
    "freshness_decay": "Medium",
    "implementation_density": 0.215,
    "verification_difficulty": "Hard"
  },
  "gate_results": {
    "definition_class_validation": {
      "passed": true,
      "reason": "Artifact follows executable intelligence schema and taxonomy."
    },
    "library_namespace_assignment": {
      "passed": true,
      "namespace": "intelligence"
    },
    "flag_integrity": {
      "passed": true,
      "class": "INTEL",
      "status": "PENDING"
    },
    "linkage_attribution": {
      "passed": true,
      "resource_pointer": "apple-notes://on-my-mac/NEW-%20May-2026/6237"
    },
    "ownership_scope_gate": {
      "passed": true,
      "owner_principal_id": "danielgoldberg",
      "visibility": "private",
      "release_state": "sealed"
    }
  },
  "synthesis": "Artifact captures 14 procedural, 10 strategic, and 5 governance units. Use procedural units for immediate execution, then vet strategic and governance units through TNF gates before protocol adoption.",
  "raw_stats": {
    "char_count": 3137,
    "unit_count": 65
  }
}
