{
  "spec": "tnf/executable-intelligence/0.2",
  "artifact_id": "eia-fc25cb060efd25dd",
  "generated_at": "2026-05-19T07:09:27+00:00",
  "classification": {
    "class": "INTEL",
    "status": "PENDING"
  },
  "namespace": "intelligence",
  "ownership": {
    "owner_principal_id": "danielgoldberg",
    "visibility": "private",
    "release_state": "sealed",
    "agent_allowlist": [],
    "release_approved_by": "",
    "released_at": "",
    "release_note": ""
  },
  "source": {
    "source_id": "yt-ai5-ynJyIKwjonM",
    "source_type": "video",
    "source_uri": "https://www.youtube.com/watch?v=ynJyIKwjonM&list=PLSdNsZjFbYrUocyjWmVB75W8cZbI0ZmvS&index=37&pp=iAQBsAgC",
    "source_title": "Agentic Search for Context Engineering \u2014 Leonie Monigatti, Elastic",
    "source_author": "",
    "source_publisher": "",
    "source_published_at": "",
    "retrieved_at": "2026-05-19T07:09:27+00:00",
    "resource_pointer": "https://www.youtube.com/watch?v=ynJyIKwjonM&list=PLSdNsZjFbYrUocyjWmVB75W8cZbI0ZmvS&index=37&pp=iAQBsAgC",
    "source_digest_sha256": "83ce83edb5286aacd93b61fcbc7cb0ded77ab85a7c1954f19c6ebd02b142e6b0"
  },
  "taxonomy": {
    "procedural": [
      "Extract concrete build/release/config instructions from transcript evidence."
    ],
    "strategic": [
      "Video Title: Agentic Search for Context Engineering \u2014 Leonie Monigatti, Elastic",
      "We<00:00:23.680><c> are</c><00:00:23.840><c> going</c><00:00:24.000><c> to</c><00:00:24.160><c> be</c><00:00:24.400><c> talking</c><00:00:24.640><c> about</c><00:00:24.880><c> agentic</c>",
      "We are going to be talking about agentic",
      "Flag governance and risk constraints before protocol adoption."
    ],
    "governance": [
      "Flag governance and risk constraints before protocol adoption."
    ]
  },
  "utility_metrics": {
    "freshness_decay": "Medium",
    "implementation_density": 0.018,
    "verification_difficulty": "Hard"
  },
  "gate_results": {
    "definition_class_validation": {
      "passed": true,
      "reason": "Artifact follows executable intelligence schema and taxonomy."
    },
    "library_namespace_assignment": {
      "passed": true,
      "namespace": "intelligence"
    },
    "flag_integrity": {
      "passed": true,
      "class": "INTEL",
      "status": "PENDING"
    },
    "linkage_attribution": {
      "passed": true,
      "resource_pointer": "https://www.youtube.com/watch?v=ynJyIKwjonM&list=PLSdNsZjFbYrUocyjWmVB75W8cZbI0ZmvS&index=37&pp=iAQBsAgC"
    },
    "ownership_scope_gate": {
      "passed": true,
      "owner_principal_id": "danielgoldberg",
      "visibility": "private",
      "release_state": "sealed"
    }
  },
  "synthesis": "Artifact captures 1 procedural, 4 strategic, and 1 governance units. Use procedural units for immediate execution, then vet strategic and governance units through TNF gates before protocol adoption.",
  "raw_stats": {
    "char_count": 4773,
    "unit_count": 56
  }
}
