{
  "spec": "tnf/executable-intelligence/0.2",
  "artifact_id": "eia-f860e0f18fee3b9c",
  "generated_at": "2026-05-19T07:42:39+00:00",
  "classification": {
    "class": "INTEL",
    "status": "PENDING"
  },
  "namespace": "intelligence",
  "ownership": {
    "owner_principal_id": "danielgoldberg",
    "visibility": "private",
    "release_state": "sealed",
    "agent_allowlist": [],
    "release_approved_by": "",
    "released_at": "",
    "release_note": ""
  },
  "source": {
    "source_id": "yt-ai5-kJNFWGXRrA4",
    "source_type": "video",
    "source_uri": "https://www.youtube.com/watch?v=kJNFWGXRrA4&list=PLSdNsZjFbYrUocyjWmVB75W8cZbI0ZmvS&index=23&pp=iAQBsAgC",
    "source_title": "Top Dev Tool Projects : 9Router, TRUST, Dokku, React-Doctor & AgentMemory",
    "source_author": "",
    "source_publisher": "",
    "source_published_at": "",
    "retrieved_at": "2026-05-19T07:42:39+00:00",
    "resource_pointer": "https://www.youtube.com/watch?v=kJNFWGXRrA4&list=PLSdNsZjFbYrUocyjWmVB75W8cZbI0ZmvS&index=23&pp=iAQBsAgC",
    "source_digest_sha256": "a98f29042756ae3474f9bb3cc9b0f041994bc15c875a6ec01e97b16bdba9e973"
  },
  "taxonomy": {
    "procedural": [
      "Video Title: Top Dev Tool Projects : 9Router, TRUST, Dokku, React-Doctor & AgentMemory",
      "source tools that improve how we build,",
      "trending open source and best dev tool",
      "From AI workflow",
      "Developers can integrate it into local",
      "coordinate your AI request pipeline.",
      "Project number two, AIDLC, workflow",
      "workflow collection from AWS Labs that",
      "Developers integrate the workflows into",
      "number three, Trust framework for",
      "trustworthy AI agent workflows.",
      "an open-source framework focused on",
      "The framework is useful for",
      "This helps teams build more",
      "structured agent workflows.",
      "open-source repository that adapts",
      "apply to agent systems.",
      "engineering thinking into agent design.",
      "to Earn to build AI-assisted operational",
      "framework for vibe coding workflows."
    ],
    "strategic": [
      "orchestration to deployment platforms",
      "routing logic, provider selection, and",
      "request handling strategies for model",
      "flexible model orchestration.",
      "simplify multi-model infrastructure",
      "Earn, platform for AI-powered earning",
      "platform focused on building workflows",
      "platform designed to build long-term",
      "model routing across different LLMs with",
      "number 15, Turrax, AI workflow platform",
      "an open-source AI platform designed to",
      "pipelines while the platform manages how",
      "from Temporal that demonstrates platform",
      "explore workflow orchestration features",
      "Self-hosted platform as a service for",
      "platform as a service that helps",
      "The platform handles"
    ],
    "governance": []
  },
  "utility_metrics": {
    "freshness_decay": "High",
    "implementation_density": 0.056,
    "verification_difficulty": "Hard"
  },
  "gate_results": {
    "definition_class_validation": {
      "passed": true,
      "reason": "Artifact follows executable intelligence schema and taxonomy."
    },
    "library_namespace_assignment": {
      "passed": true,
      "namespace": "intelligence"
    },
    "flag_integrity": {
      "passed": true,
      "class": "INTEL",
      "status": "PENDING"
    },
    "linkage_attribution": {
      "passed": true,
      "resource_pointer": "https://www.youtube.com/watch?v=kJNFWGXRrA4&list=PLSdNsZjFbYrUocyjWmVB75W8cZbI0ZmvS&index=23&pp=iAQBsAgC"
    },
    "ownership_scope_gate": {
      "passed": true,
      "owner_principal_id": "danielgoldberg",
      "visibility": "private",
      "release_state": "sealed"
    }
  },
  "synthesis": "Artifact captures 20 procedural, 17 strategic, and 0 governance units. Use procedural units for immediate execution, then vet strategic and governance units through TNF gates before protocol adoption.",
  "raw_stats": {
    "char_count": 13195,
    "unit_count": 360
  }
}
