{
  "spec": "tnf/executable-intelligence/0.2",
  "artifact_id": "eia-6f06354674f680be",
  "generated_at": "2026-05-17T14:17:15+00:00",
  "classification": {
    "class": "INTEL",
    "status": "PENDING"
  },
  "namespace": "intelligence",
  "ownership": {
    "owner_principal_id": "danielgoldberg",
    "visibility": "private",
    "release_state": "sealed",
    "agent_allowlist": [],
    "release_approved_by": "",
    "released_at": "",
    "release_note": ""
  },
  "source": {
    "source_id": "apple-notes-new-may-2026-6212",
    "source_type": "note",
    "source_uri": "apple-notes://on-my-mac/NEW-%20May-2026/6212",
    "source_title": "OK! It is working! Very Good! Now keep itterating through and over\u2026",
    "source_author": "",
    "source_publisher": "",
    "source_published_at": "",
    "retrieved_at": "2026-05-17T14:17:15+00:00",
    "resource_pointer": "apple-notes://on-my-mac/NEW-%20May-2026/6212",
    "source_digest_sha256": "6adc0847323314ced4c78ddb9dff32a3f1a164688a1c2a3dc4b9b2ff0dd9d531"
  },
  "taxonomy": {
    "procedural": [],
    "strategic": [],
    "governance": [
      "protocol, every directive, let's make some branches accessible only to"
    ]
  },
  "utility_metrics": {
    "freshness_decay": "Medium",
    "implementation_density": 0.0,
    "verification_difficulty": "Hard"
  },
  "gate_results": {
    "definition_class_validation": {
      "passed": true,
      "reason": "Artifact follows executable intelligence schema and taxonomy."
    },
    "library_namespace_assignment": {
      "passed": true,
      "namespace": "intelligence"
    },
    "flag_integrity": {
      "passed": true,
      "class": "INTEL",
      "status": "PENDING"
    },
    "linkage_attribution": {
      "passed": true,
      "resource_pointer": "apple-notes://on-my-mac/NEW-%20May-2026/6212"
    },
    "ownership_scope_gate": {
      "passed": true,
      "owner_principal_id": "danielgoldberg",
      "visibility": "private",
      "release_state": "sealed"
    }
  },
  "synthesis": "Artifact captures 0 procedural, 0 strategic, and 1 governance units. Use procedural units for immediate execution, then vet strategic and governance units through TNF gates before protocol adoption.",
  "raw_stats": {
    "char_count": 879,
    "unit_count": 15
  }
}
