{
  "spec": "tnf/executable-intelligence/0.2",
  "artifact_id": "eia-f506223a2e833c86",
  "generated_at": "2026-05-19T07:42:49+00:00",
  "classification": {
    "class": "INTEL",
    "status": "PENDING"
  },
  "namespace": "intelligence",
  "ownership": {
    "owner_principal_id": "danielgoldberg",
    "visibility": "private",
    "release_state": "sealed",
    "agent_allowlist": [],
    "release_approved_by": "",
    "released_at": "",
    "release_note": ""
  },
  "source": {
    "source_id": "yt-ai5-7xuWZ-3lyQE",
    "source_type": "video",
    "source_uri": "https://www.youtube.com/watch?v=7xuWZ-3lyQE&list=PLSdNsZjFbYrUocyjWmVB75W8cZbI0ZmvS&index=27&t=1669s&pp=iAQBsAgC",
    "source_title": "Hermes Agent just got 10X Better (Agentic OS)",
    "source_author": "",
    "source_publisher": "",
    "source_published_at": "",
    "retrieved_at": "2026-05-19T07:42:49+00:00",
    "resource_pointer": "https://www.youtube.com/watch?v=7xuWZ-3lyQE&list=PLSdNsZjFbYrUocyjWmVB75W8cZbI0ZmvS&index=27&t=1669s&pp=iAQBsAgC",
    "source_digest_sha256": "955ac7fb679d26f5a639239e9d7d37b796cc953581a12502b431307ff5625113"
  },
  "taxonomy": {
    "procedural": [
      "Video Title: Hermes Agent just got 10X Better (Agentic OS)",
      "(Transcript unavailable in this run.)"
    ],
    "strategic": ["Video Title: Hermes Agent just got 10X Better (Agentic OS)"],
    "governance": []
  },
  "utility_metrics": {
    "freshness_decay": "Medium",
    "implementation_density": 0.2,
    "verification_difficulty": "Hard"
  },
  "gate_results": {
    "definition_class_validation": {
      "passed": true,
      "reason": "Artifact follows executable intelligence schema and taxonomy."
    },
    "library_namespace_assignment": {
      "passed": true,
      "namespace": "intelligence"
    },
    "flag_integrity": {
      "passed": true,
      "class": "INTEL",
      "status": "PENDING"
    },
    "linkage_attribution": {
      "passed": true,
      "resource_pointer": "https://www.youtube.com/watch?v=7xuWZ-3lyQE&list=PLSdNsZjFbYrUocyjWmVB75W8cZbI0ZmvS&index=27&t=1669s&pp=iAQBsAgC"
    },
    "ownership_scope_gate": {
      "passed": true,
      "owner_principal_id": "danielgoldberg",
      "visibility": "private",
      "release_state": "sealed"
    }
  },
  "synthesis": "Artifact captures 2 procedural, 1 strategic, and 0 governance units. Use procedural units for immediate execution, then vet strategic and governance units through TNF gates before protocol adoption.",
  "raw_stats": {
    "char_count": 522,
    "unit_count": 10
  }
}
